{
  "schema_version": "1.0.0",
  "python": ".venv/Scripts/python.exe",
  "output_dir": "outputs",
  "runtime": {
    "max_concurrent_jobs": 1,
    "default_timeout_seconds": 1800,
    "max_image_bytes": 26214400
  },
  "notifications": {
    "webhook_url": null,
    "on_success": true,
    "on_failure": true
  },
  "scripts": [
    {
      "id": "ocr",
      "name": "Image Processor",
      "description": "Turn flight-log photos into a clean spreadsheet.",
      "icon": "bi-image",
      "badge": "Active",
      "script": "scripts/ocr/main.py",
      "cwd": ".",
      "enabled": true,
      "timeout_seconds": 1800,
      "form_note": "Use Browse to pick an image folder (or upload a single image). CSV downloads from the result panel.",
      "summary_keys": [
        "airlines",
        "input_mode"
      ],
      "stages": [
        {
          "id": "read",
          "label": "Read images",
          "match": "Processing:"
        },
        {
          "id": "write",
          "label": "Write CSV",
          "match": "\u2192 csv="
        },
        {
          "id": "qc",
          "label": "Quality check",
          "match": "QC:"
        },
        {
          "id": "done",
          "label": "Finalize",
          "match": "CSV:"
        }
      ],
      "inputs": [
        {
          "id": "airlines",
          "label": "Airline",
          "type": "select",
          "required": true,
          "hidden": false,
          "default": "Buddha",
          "group": "Source",
          "width": "half",
          "help": "Parser plugin / OCR template.",
          "cli": {
            "flag": "--airlines"
          },
          "options": [
            {
              "value": "Buddha",
              "label": "Buddha Air"
            },
            {
              "value": "Yeti",
              "label": "Yeti Airlines"
            }
          ]
        },
        {
          "id": "input_mode",
          "label": "Input mode",
          "type": "select",
          "required": true,
          "hidden": false,
          "default": "folder",
          "group": "Source",
          "width": "half",
          "help": "Batch folder or a single uploaded image.",
          "cli": {
            "flag": "--input-mode"
          },
          "options": [
            {
              "value": "file",
              "label": "Single image"
            },
            {
              "value": "folder",
              "label": "Batch folder"
            }
          ]
        },
        {
          "id": "image_folder",
          "label": "Image Folder",
          "type": "folder",
          "required": false,
          "hidden": false,
          "group": "Source",
          "width": "full",
          "help": "Used when input mode is Batch folder.",
          "cli": {
            "flag": "--images"
          }
        },
        {
          "id": "image_file",
          "label": "Image File",
          "type": "file",
          "required": false,
          "hidden": false,
          "group": "Source",
          "width": "full",
          "help": "Used when input mode is Single image.",
          "cli": {
            "flag": "--image"
          },
          "accept": ".png,.jpg,.jpeg,.tif,.tiff,.bmp,.webp"
        }
      ],
      "progress_hints": [
        {
          "match": "Processing:",
          "label": "Reading images\u2026"
        },
        {
          "match": "\u2192 csv=",
          "label": "Writing CSV\u2026"
        },
        {
          "match": "QC:",
          "label": "Quality check\u2026"
        },
        {
          "match": "CSV:",
          "label": "Finalizing\u2026"
        },
        {
          "match": "Done:",
          "label": "Complete"
        }
      ],
      "report": {
        "stdout_line_prefix": "CSV:",
        "glob": "*.csv",
        "pick": "newest_after_start",
        "result_ui": {
          "mode": "per_source",
          "title": "Outputs",
          "lead": "Select an image to preview its CSV.",
          "stats": "ocr"
        }
      },
      "summary_patterns": {
        "images_processed": "Processing:\\s*(\\S+)",
        "report_path": "CSV:\\s*(.+)",
        "qc_summary": "QC:\\s*(.+)",
        "rows_total": "rows_total=(\\d+)"
      }
    },
    {
      "id": "pnr",
      "name": "PNR \u2014 Yeti B2B booking",
      "description": "Book group seats on Yeti Airlines and collect the booking codes.",
      "icon": "bi-airplane",
      "badge": "Active",
      "script": "scripts/pnr/main.py",
      "cwd": ".",
      "enabled": true,
      "timeout_seconds": 7200,
      "form_note": "Results CSV is downloadable from the result panel after the run finishes.",
      "summary_keys": [
        "origin",
        "destination",
        "flight_number",
        "start_date",
        "end_date"
      ],
      "stages": [
        {
          "id": "login",
          "label": "Login",
          "match": "Logging in"
        },
        {
          "id": "search",
          "label": "Search",
          "match": "Searching"
        },
        {
          "id": "select",
          "label": "Select fare",
          "match": "Match:"
        },
        {
          "id": "book",
          "label": "Book",
          "match": "[advance"
        },
        {
          "id": "confirm",
          "label": "Confirm",
          "match": "Booking confirmed"
        },
        {
          "id": "export",
          "label": "Export",
          "match": "Writing CSV"
        }
      ],
      "inputs": [
        {
          "id": "origin",
          "label": "Origin",
          "type": "select",
          "required": true,
          "default": "KTM",
          "group": "Route & flight",
          "width": "half",
          "help": "From airport code.",
          "options": [
            {
              "value": "KTM",
              "label": "KTM \u2014 Kathmandu"
            },
            {
              "value": "BIR",
              "label": "BIR \u2014 Biratnagar"
            },
            {
              "value": "BDP",
              "label": "BDP \u2014 Bhadrapur"
            },
            {
              "value": "BWA",
              "label": "BWA \u2014 Bhairahawa"
            },
            {
              "value": "JKR",
              "label": "JKR \u2014 Janakpur"
            },
            {
              "value": "KEP",
              "label": "KEP \u2014 Nepalgunj"
            },
            {
              "value": "PKR",
              "label": "PKR \u2014 Pokhara"
            }
          ],
          "cli": {
            "flag": "--origin",
            "position": null
          }
        },
        {
          "id": "destination",
          "label": "Destination",
          "type": "select",
          "required": true,
          "default": "BIR",
          "group": "Route & flight",
          "width": "half",
          "help": "To airport code.",
          "options": [
            {
              "value": "BIR",
              "label": "BIR \u2014 Biratnagar"
            },
            {
              "value": "KTM",
              "label": "KTM \u2014 Kathmandu"
            },
            {
              "value": "BDP",
              "label": "BDP \u2014 Bhadrapur"
            },
            {
              "value": "BWA",
              "label": "BWA \u2014 Bhairahawa"
            },
            {
              "value": "JKR",
              "label": "JKR \u2014 Janakpur"
            },
            {
              "value": "KEP",
              "label": "KEP \u2014 Nepalgunj"
            },
            {
              "value": "PKR",
              "label": "PKR \u2014 Pokhara"
            },
            {
              "value": "TPU",
              "label": "TPU \u2014 Tikapur"
            }
          ],
          "cli": {
            "flag": "--destination",
            "position": null
          }
        },
        {
          "id": "flight_number",
          "label": "Flight number",
          "type": "text",
          "required": true,
          "default": "781",
          "group": "Route & flight",
          "width": "half",
          "help": "Number only (no YT prefix), e.g. 781.",
          "cli": {
            "flag": "--flight-number",
            "position": null
          }
        },
        {
          "id": "fare_code",
          "label": "Fare code",
          "type": "text",
          "required": true,
          "default": "E1",
          "group": "Route & flight",
          "width": "half",
          "help": "Fare class as shown in the portal table.",
          "cli": {
            "flag": "--fare-code",
            "position": null
          }
        },
        {
          "id": "start_date",
          "label": "Start date",
          "type": "text",
          "input_type": "date",
          "required": true,
          "default": "2026-08-02",
          "group": "Dates & group",
          "width": "half",
          "help": "Inclusive start of the booking range.",
          "cli": {
            "flag": "--start-date",
            "position": null
          }
        },
        {
          "id": "end_date",
          "label": "End date",
          "type": "text",
          "input_type": "date",
          "required": true,
          "default": "2026-08-31",
          "group": "Dates & group",
          "width": "half",
          "help": "Inclusive end of the booking range.",
          "cli": {
            "flag": "--end-date",
            "position": null
          }
        },
        {
          "id": "adults",
          "label": "Adults",
          "type": "text",
          "input_type": "number",
          "required": true,
          "default": "10",
          "group": "Dates & group",
          "width": "half",
          "help": "Group size (adult passengers).",
          "cli": {
            "flag": "--adults",
            "position": null
          }
        },
        {
          "id": "group_name",
          "label": "Group name",
          "type": "text",